company_name,hq_location,description,founded_date,founders,num_employees,funding_status,last_funding_date,last_funding_type,estimated_revenue,website,description_full,last_funding_amount,top_5_investors,total_funding_amount,acquired_by,acquired_date,acquired_price,ipo_status,ipo_date,stock_symbol
Coinbase,"San Francisco,California,United States","Coinbase is a cryptocurrency exchange and cryptocurrency wallet platform that allows users to buy, sell, and store various cryptocurrencies.","Jun 20, 2012","Brian Armstrong,Fred Ehrsam",1001-5000,IPO,"Mar 13, 2024",Post-IPO Debt,$1B to $10B,www.coinbase.com,"Coinbase is an online platform that allows merchants, consumers, and traders to transact with digital currency. It allows its users to create their own Bitcoin wallets and start buying or selling bitcoins by connecting with their bank accounts. Also, it provides a series of merchant payment processing systems and tools that support many highly-trafficked websites on the internet. Coinbase was launched in 2012 with a mission to create an open financial system for the world. It is operated from San Francisco, California.","$1,100,000,000","Andreessen Horowitz,Digital Currency Group,Y Combinator,Polychain,Employee Stock Option Fund","$1,778,684,825",—,—,—,Public,"Aug 5, 2022",1COIN
Eventbrite,"San Francisco,California,United States",Eventbrite develops an online platform that lets users find and create events.,2006,"Julia Hartz,Justin Goodin,Kevin Hartz,Renaud Visage",501-1000,IPO,"May 11, 2020",Post-IPO Equity,$50M to $100M,www.eventbrite.com,"Eventbrite develops an online platform that lets users find and create events. Its platform helps them plan events, such as event academies, classes and workshops, conferences, endurance, food and drink, music, nonprofits, and fundraisers, performing and visual arts, politics, and reunions. Eventbrite's platform also lets users sell tickets, register online, post events, manage events online, event management, register event for free online, and search San Francisco events. Moreover, the company offers mobile application opportunities. Eventbrite serves customers worldwide. Renaud Visage and Julia and Kevin Hartz founded Eventbrite in 2006, with its headquarters in San Francisco in California.","$225,000,000","Sequoia Capital,EquityZen,T. Rowe Price,Employee Stock Option Fund,Uncork Capital","$557,250,000",—,—,—,Public,"Sep 19, 2018",EB
Microsoft,"Redmond,Washington,United States","Microsoft is a software corporation that develops, manufactures, licenses, supports, and sells a range of software products and services.","Apr 4, 1975","Bill Gates,Paul Allen",10001+,IPO,"Jan 2, 2024",Undisclosed,$10B+,www.microsoft.com,"Microsoft is an American multinational corporation that develops, manufactures, licenses, supports, and sells a range of software products and services.Microsoft’s devices and consumer (D&C) licensing segment licenses the Windows operating system and related software, Microsoft Office for consumers, and the Windows Phone operating system. The company’s computing and gaming hardware segment provides Xbox gaming and entertainment consoles and accessories, second-party and third-party video games, and Xbox Live subscriptions; surface devices and accessories; and Microsoft PC accessories. Its phone hardware segment offers Lumia smartphones and other non-Lumia phones. Its D&C segment provides Windows Store, Xbox Live transactions, and Windows phone store; search advertising; display advertising; Office 365 Home and Office 365 Personal; first-party video games; and other consumer products and services as well as operating retail stores.Microsoft’s commercial licensing segments license server products, including Windows Server, Microsoft SQL Server, Visual Studio, System Center, and related Client Access Licenses (CALs); Windows Embedded; Windows operating system; Microsoft Office for business, including Office, Exchange, SharePoint, Lync, and related CALs; Microsoft Dynamics business solutions; and Skype. Its commercial segment offers enterprise services, including premier support services and Microsoft consulting services; commercial cloud comprising Office 365 Commercial, other Microsoft Office online offerings, Dynamics CRM Online, and Microsoft Azure; and other commercial products and online services.The company markets and distributes its products through original equipment manufacturers, distributors, and resellers, as well as online.",—,"KB Securities,Lucky Everlasting Peace,Technology Venture Investors","$1,000,000",—,—,—,Public,"Mar 13, 1986",MSFT
Socure,"Incline Village,Nevada,United States",Socure is a predictive analytics platform for digital identity verification of consumers.,"Sep 1, 2012","Johnny Ayers,Sunil Madhu",501-1000,Late Stage Venture,"Mar 8, 2023",Debt Financing,—,www.socure.com,"Socure is the leading platform for digital identity verification and trust. Its predictive analytics platform applies artificial intelligence and machine learning techniques with trusted online/offline data intelligence from email, phone, address, IP, device, velocity, and the broader internet to verify identities in real time. The company has more than 2,000 customers across the financial services, government, gaming, healthcare, telecom, and e-commerce industries, including four of the top five banks, seven of the top 10 card issuers, three of the top MSBs, the top payroll provider, the top credit bureau, the top online gaming operator, the top Buy Now, Pay Later (BNPL) providers, and over 250 of the largest fintechs. Marquee customers include Chime, SoFi, Varo, Robinhood, Public, Stash, Gusto, and DraftKings. Socure customers have become investors in the company including Citi Ventures, Capital One Ventures, MVB Bank, and Synchrony. Additional investors include Accel, T. Rowe Price, Bain Capital Ventures, Tiger Global, Commerce Ventures, Scale Venture Partners, Sorenson, Flint Capital, Two Sigma Ventures, and others.Socure has received numerous industry awards and accolades, including named to the 2021 & 2022 Forbes Cloud 100 List, Forbes’ Fintech 50 List 2021, and Forbes’ America’s Best Startup Employers 2021, being named to CB Insights: The Fintech 250 for the third year in a row, being awarded Best New Technology Introduced Over the Last 12 Months—Data and Data Services at the 2020 American Financial Technology Awards (AFTAs), being ranked number 70 in Deloitte’s Technology Fast 500™, being listed as a Gartner Cool Vendor, being recognized by Forbes as one of the Top 25 Machine Learning Startups to Watch, being awarded Finovate’s Award for Best Use of AI/ML, to name a few. Founder/CEO Johnny Ayers has also been recognized by Goldman Sachs as one of the 100 Most Intriguing Entrepreneurs of 2021 and as an EY Entrepreneur of the Year 2022.","$95,000,000","Bain Capital Ventures,T. Rowe Price,Silicon Valley Bank,JP Morgan,Accel","$744,400,000",—,—,—,Private,—,—
Cedar,"New York,New York,United States","Cedar is a patient payment and engagement platform for hospitals, health systems, and medical groups that elevates the patient experience.",2016,"Arel Lidow,Florian Otto,Kareem Zaki",101-250,Late Stage Venture,"Dec 19, 2022",Series D,$1M to $10M,www.cedar.com,"Cedar is a patient payment and engagement platform for hospitals, health systems, and medical groups that elevate the end-to-end patient experience. The platform leverages advanced data science to customize and simplify the payment experience, resulting in a modern, consumer-friendly way for patients to plan for and pay their bills.It was founded in 2016 and headquartered in New York, United States.","$68,361,000","JP Morgan Chase,Andreessen Horowitz,Thrive Capital,Founders Fund,Memorial Hermann Foundation","$419,361,000",—,—,—,Private,—,—
Pendo,"Raleigh,North Carolina,United States",Pendo is the all-in-one product experience platform.,Oct 2013,"Eric Boduch,Erik Troan,Rahul Jain,Todd Olson",501-1000,Late Stage Venture,"Nov 11, 2021",Secondary Market,$100M to $500M,www.pendo.io,"Pendo’s mission is to elevate the world’s experience with software. Pendo’s product experience platform allows companies to make product intelligence actionable with speed and scale, giving rise to a new generation of companies that put product at the center of everything. Pendo customers include the world’s leading companies, including Verizon, Morgan Stanley, LabCorp, OpenTable, Okta, Salesforce, and Zendesk. Through Mind the Product and customer communities, sponsored events and podcast, Pendo aims to support the success of product and digital leaders everywhere. Pendo is headquartered in Raleigh, North Carolina and has offices around the world.","$110,000,000","General Atlantic,B Capital,Tiger Global Management,Spark Capital,Sapphire Ventures","$469,500,000",—,—,—,Private,—,—
Cockroach Labs,"New York,New York,United States",Cockroach Labs is a software company that develops a cloud-native SQL database for modern cloud applications.,Feb 2015,"Benjamin Darnell,Peter Mattis,Spencer Kimball",251-500,Late Stage Venture,"Dec 16, 2021",Series F,$1M to $10M,www.cockroachlabs.com/,"Cockroach Labs is behind Cockroach DB, the cloud-native, distributed SQL database to modern cloud applications. It helps companies of all sizes—and the apps they develop— to scale fast, survive anything, and thrive everywhere. CockroachDB is in use at some of the world's largest enterprises across all industries, including Equifax, Bose, Comcast, and some of the largest companies in banking, retail, and media.","$278,000,000","Sequoia Capital,Google Ventures,JPMorgan Chase & Co.,Benchmark,Coatue","$633,100,000",—,—,—,Private,—,—
Talkdesk,"San Francisco,California,United States",Talkdesk offers an enterprise contact center platform that allows companies to make the customer experience a competitive advantage.,2011,"Cristina Fonseca,Tiago Paiva",1001-5000,Late Stage Venture,"Aug 12, 2021",Series D,$100M to $500M,talkdesk.com,"Talkdesk offers an enterprise contact center platform that allows companies to make the customer experience a competitive advantage.With its performance and consumer-like ease of use, Talkdesk easily adapts to the evolving needs of sales and support teams and their end customers, resulting in increased customer satisfaction, productivity, and cost savings. Over 1,400 innovative enterprises around the world, including IBM, Acxiom, and Zumiez rely on Talkdesk to power their customer interactions.The San Francisco, California-based company was formed by Cristina Fonseca and Tiago Paiva in 2011.","$230,000,000","500 Global,Franklin Templeton,Viking Global Investors,Lead Edge Capital,Salesforce Ventures","$497,450,000",—,—,—,Private,—,—
Squarespace,"New York,New York,United States",Squarespace is a website building and hosting platform that helps users create websites without needing advanced technical skills.,2003,Anthony Casalena,1001-5000,IPO,"Nov 15, 2023",Post-IPO Secondary,$100M to $500M,www.squarespace.com,"Squarespace is a website building and e-commerce platform that enables users to build brands and transact with their customers. The company's suite of products helps entrepreneurs, creatives, and professionals manage their projects and businesses through websites, domains, e-commerce, marketing tools, scheduling, and Unfold, tools for managing a social media presence. It democratizes access to design, helping their customers in 180+ countries maintain consistent branding across all digital touchpoints to stand out online. The company is backed by Index Ventures, Dragoneer, Tiger Global, D1 Capital Partners, Fidelity Management & Research Company, T. Rowe Price Associates, Spruce House, as well as Accel and General Atlantic.",—,"Fidelity,General Atlantic,T. Rowe Price,Employee Stock Option Fund,Accel","$578,500,000",—,—,—,Public,"Jul 16, 2021",8DT
Airbnb,"San Francisco,California,United States","Airbnb is an online community marketplace for people to list, discover, and book accommodations through mobile phones or the internet.","Aug 11, 2008","Brian Chesky,Joe Gebbia,Nathan Blecharczyk",5001-10000,IPO,"Jun 3, 2020",Secondary Market,$1B to $10B,www.airbnb.com,"Airbnb is an online community marketplace for people to list, discover, and book accommodations through mobile phones or the Internet.The company connects travelers seeking authentic experiences with hosts offering unique, inspiring spaces. Whether the available space is a castle for a night, a sailboat for a week, or an apartment for a month, Airbnb is the easiest way for people to showcase these distinctive spaces to an audience of millions. By facilitating bookings and financial transactions, Airbnb makes the process of listing or booking a space effortless and efficient.With 4,500,000 listings in over 65,000 cities in 191 countries, the company offers the widest variety of unique spaces for everyone at any price point around the globe.",—,"Citi,Fidelity,JP Morgan Chase,Silver Lake,TPG","$6,423,132,065",—,—,—,Public,"Apr 16, 2021",0A8C
Ironclad,"San Francisco,California,United States",Ironclad is a contract lifecycle management platform used by companies to handle every type of contract workflow.,2014,"Cai GoGwilt,Jason Boehmig",251-500,Late Stage Venture,"Jan 18, 2022",Series E,$50M to $100M,www.ironcladapp.com,"Ironclad is a contracting platform that helps transform contract processes by automating workflows and approvals. Its platform also automatically identifies key terms and entities, turns contracts into code and allows users to search, tag, and manage their contracts to help legal, sales, and operations teams streamline the way they create, store, and combine contracts as intelligence assets.","$150,000,000","Sequoia Capital,Y Combinator,Franklin Templeton,Soma Capital,UpHonest Capital","$334,000,000",—,—,—,Private,—,—
Grafana Labs,"New York,New York,United States","Grafana Labs is an open source software platform built to support monitoring, visualization, and metric analytics.",2014,"Anthony Woods,Raj Dutt,Torkel Ödegaard",501-1000,Late Stage Venture,"Apr 6, 2022",Series D,$100M to $500M,grafana.com,"Grafana Labs provides an open and composable monitoring and observability stack built around Grafana, the leading open source technology for dashboards and visualization. There are more than 3,000 Grafana Labs customers, including Bloomberg, Citigroup, Dell Technologies, Salesforce, and TomTom, and more than 20M Grafana users around the world. Grafana Labs helps companies manage their observability strategies with the LGTM Stack, which can be run fully managed with Grafana Cloud or self-managed with the Grafana Enterprise offerings, both featuring scalable metrics (Grafana Mimir), logs (Grafana Loki), and traces (Grafana Tempo) as well as extensive enterprise data source plugins, dashboard management, alerting, reporting, and security. Grafana Labs is backed by leading investors Lightspeed Venture Partners, Lead Edge Capital, GIC, Sequoia Capital, Coatue, and J.P. Morgan.","$240,000,000","Sequoia Capital,Lightspeed Venture Partners,JP Morgan,Coatue,Lead Edge Capital","$535,230,000",—,—,—,Private,—,—
Etsy,"Brooklyn,New York,United States",Etsy is an e-commerce site and a smartphone application for buying and selling handmade and vintage items.,"Jun 18, 2005","Chris Maguire,Haim Schoppik,Jared Tarbell,Robert Kalin",1001-5000,IPO,"Feb 1, 2024",Post-IPO Equity,$100M to $500M,www.etsy.com,"Etsy is an e-commerce site and a smartphone application for buying and selling handmade and vintage items. Users can find products in the categories of clothing and accessories, jewelry, craft supplies and tools, weddings, entertainment, home and living, kids and babies, vintage, and more. Etsy was launched by Robert Kalin, Haim Schoppik, Jared Tarbell, and Chris Maguire in June 2005 and is based in Brooklyn, New York.",—,"TPG,Employee Stock Option Fund,Union Square Ventures,Accel,Elliott Investment Management","$97,256,127",—,—,—,Public,"Apr 1, 2015",ETSY
IBM,"Armonk,New York,United States","IBM is an IT technology and consulting firm providing computer hardware, software, infrastructure, and hosting services.","Jun 6, 1911","Alex Naoumidis,Alfred Aday,Barrett Rodda,Clifford Mahu,Cody Bellm,Kengo Horibe,Lokesh Bevara,Michelle Esgar,Rachel Reinitz,Richard Kateley,Tally Mack,Thomas J. Watson,Vilas Sastry",10001+,IPO,—,—,$10B+,www.ibm.com,"IBM is a technology and innovation company that offers a wide range of technology and consulting services; a broad portfolio of middleware for collaboration, predictive analytics, software development, and systems management.",—,—,—,—,—,—,Public,"Jan 16, 2015",IBM
Thumbtack,"San Francisco,California,United States",A technology company helping millions of people confidently care for and improve their homes.,2008,"American Healthcare Compliance,Jonathan Swanson,Marco Zappacosta,Sander Daniels",1001-5000,Late Stage Venture,"Jun 15, 2021",Series G,$100M to $500M,www.thumbtack.com,"We’re Thumbtack, a technology company helping millions of people confidently care for and improve their homes. Our homeowners get personalized guidance on what to do and when to do it as well as who to hire from our growing community of 300,000 local service businesses. Every day in every county of the U.S., people turn to Thumbtack to complete small fixes, routine maintenance, and major improvements. With over 10 million 5-star projects and counting, we empower homeowners to take control and local businesses to grow.","$275,000,000","Sequoia Capital,CapitalG,Baillie Gifford,Tiger Global Management,Javelin Venture Partners","$698,200,000",—,—,—,Private,—,—
Activision Blizzard,"Santa Monica,California,United States",Activision Blizzard creates interactive gaming and entertainment experiences.,2008,—,5001-10000,M&A,"Dec 1, 2021",Post-IPO Equity,$1B to $10B,activisionblizzard.com,"Activision Blizzard’s mission is to connect and engage the world through epic entertainment. One of the successful interactive entertainment companies, its franchises include popular games like Call of Duty®, Warcraft® (Warcraft®, World of Warcraft®, Hearthstone®), Overwatch®, Diablo®, StarCraft®, Candy Crush™, Crash Bandicoot™, Guitar Hero®, Tony Hawk's™ Pro Skater™, Bubble Witch™, Pet Rescue™, Farm Heroes™, and Spyro™. Through these franchises, the company reaches more than 400 million players across 190 countries. Activision Blizzard’s business units and development studios include Activision Publishing, Blizzard Entertainment, King Games, Infinity Ward, Raven Software, Sledgehammer Games, Treyarch Studios, Beenox, Demonware, High Moon Studios, and Toys for Bob. The company supports corporate social responsibility initiatives that are directly tied to its franchises. As an example, the Call of Duty Endowment has helped find employment for over 100,000 veterans. Bobby Kotick currently serves as Chief Executive Officer of Activision Blizzard. He became CEO of Activision in 1991 after purchasing a company stake the previous year. Kotick engineered a merger between Activision and Vivendi Games during the late 2000s, which led to the creation of Activision Blizzard in 2008 and his being named the company's inaugural CEO. Activision Blizzard is a member of the Fortune 500 and the S&P 500. Activision Blizzard has been recognized as one of FORTUNE magazine's “100 Best Companies To Work For"".","$975,000,000",Berkshire Hathaway,"$975,000,000",Microsoft,"Apr 28, 2022","$68,700,000,000",Public,"Nov 5, 1993",ATVI
Forter,"New York,New York,United States","Forter offers a fraud solution that helps retailers grow sales, lower costs, and improve customer experience via its Decision as Service.",2013,"Alon Shemesh,Liron Damri,Liron Damri,Michael Reitblat",251-500,Late Stage Venture,"Jul 1, 2022",Secondary Market,$100M to $500M,www.forter.com,"Forter is a company that delivers real-time, completely automated, fraud prevention solutions for online merchants. It creates a completely fraud-free environment for the retailers through which they have the ability to make decisions that are solely based on what is good for their business. The company’s system is designed to be consumer-centric, blocking fraud with accuracy, and at the same time enabling growth by increasing approvals and ensuring a better customer experience.",—,"Adage Capital Management,L Catterton,Bessemer Venture Partners,Scale Venture Partners,New Enterprise Associates","$525,101,500",—,—,—,Private,—,—
Lyft,"San Francisco,California,United States","Lyft designs, markets, and operates a mobile application that matches drivers with passengers who request rides.","May 22, 2012","John Zimmer,Logan Green,Matt Van Horn",5001-10000,IPO,"Feb 21, 2024",Post-IPO Debt,$1B to $10B,lyft.com,"Lyft designs, markets, and operates a mobile application that matches drivers with passengers who request rides, and also allows payment through the app. It also allows riders to schedule rides up to seven days in advance.Its services are primarily focused on college, university, and corporate communities. Lyft is a fast-growing ridesharing company in the U.S. and is available to 95 percent of the US population.Lyft was founded in June 2012 by Logan Green and John Zimmer in San Francisco, California.","$400,000,000","Fidelity,Alibaba Group,General Motors,Tencent,Andreessen Horowitz","$5,313,606,778",—,—,—,Public,"Mar 29, 2019",LYFT
Automattic,"San Francisco,California,United States","The people behind WordPress.com, WooCommerce, Jetpack, WordPress VIP, Tumblr, Day One, Newspack, and more.",2005,Matt Mullenweg,1001-5000,—,"Feb 17, 2021",Venture - Series Unknown,$100M to $500M,automattic.com,"We are the people behind WordPress.com, WooCommerce, Jetpack, WordPress VIP, Simplenote, Longreads, The Atavist, WPScan, Akismet, Gravatar, Crowdsignal, Cloudup, Tumblr, Day One, Pocket Casts, Newspack, and more. We believe in making the web a better place.We’re a distributed company with 1,945 Automatticians in 95 countries speaking 120 different languages. We’re committed to diversity, equity, and inclusion, and our common goal is to democratize publishing and commerce so that anyone with a story can tell it, and anyone with a product can sell it, regardless of income, gender, politics, language, or where they live in the world.We believe in Open Source and the vast majority of our work is available under the GPL.","$288,000,000","ICONIQ Capital,Polaris Partners,BlackRock,The New York Times,ICONIQ Growth","$985,900,000",—,—,—,Private,—,—
Melio,"New York,New York,United States",Melio is a fintech company that gives small businesses a way to digitally manage their business-to-business payments and receivables.,"Jul 1, 2018","Ilan Atias,Matan Bar,Ziv Paz",501-1000,Late Stage Venture,"Sep 14, 2021",Series D,$1M to $10M,www.meliopayments.com,"Melio is a fintech company that gives small businesses a way to digitally manage their business-to-business payments and receivables. It was built to help small businesses keep up with business. A B2B payments experience that not only saves time but also significantly improves cash flow. A payment workflow so simple it helps businesses focus on their customers, not their back office.It was founded in 2018 and is based in New York, New York.","$250,000,000","Intuit,General Catalyst,Thrive Capital,Bessemer Venture Partners,Accel","$504,000,000",—,—,—,Private,—,—
Grubhub,"Chicago,Illinois,United States",Grubhub is a online and mobile food ordering and delivery marketplace dedicated to connecting diners with local restaurants.,2004,"Jason Finger,Matt Maloney,Mike Evans",1001-5000,M&A,"Jul 6, 2022",Post-IPO Equity,$100M to $500M,www.grubhub.com,"GrubHub is an online and mobile food-ordering and delivery marketplace with a comprehensive network of restaurant partners, as well as nearly 24 million active diners. Dedicatedto connecting diners with the food they love from their favorite local restaurants, Grubhub elevates food ordering through innovative restaurant technology, easy-to-use platforms, and an improved delivery experience. Grubhub features nearly 300,000 restaurants and is proud to partner with more than 200,000 of these restaurants in over 4,000 U.S. cities. The Grubhub portfolio of brands includes Grubhub, Seamless, LevelUp, AllMenus, and MenuPages.",—,"Amazon,Lightspeed Venture Partners,T. Rowe Price,Benchmark,Yum!","$284,100,000",Just Eat Takeaway,"Jun 10, 2020","$7,300,000,000",Public,"Apr 7, 2014",GRUB
Tinder,"West Hollywood,California,United States",Tinder anonymously finds people nearby that like each other and connects them if they are both interested.,"Sep 1, 2012","Christopher Gulczynski,Dinesh Moorjani,Jonathan Badeen,Justin Mateen,Sean Rad,Whitney Wolfe Herd",501-1000,—,"Oct 10, 2017",Venture - Series Unknown,$10M to $50M,www.tinder.com,"Tinder anonymously finds people nearby that like each other and connects them if they are both interested.Every time you open Tinder, you’ll immediately see new, interesting people nearby, along with friends or interests you have in common. Swipe right to like or left to pass on each person’s profile. All swipes are anonymous. No one will ever know you’ve passed on their profile. Only once you’ve both swiped right on each other will your newfound match be revealed.",—,"Benchmark,IAC","$50,000,000",—,—,—,Private,—,—
